[2025-12-28 00:00:01] =========================================
[2025-12-28 00:00:01] Starting automated crawl & processing
[2025-12-28 00:00:01] =========================================
[2025-12-28 00:00:01] Phase 1: Crawling articles...
[2025-12-28 00:00:01]   Crawling: politics
    Finished `release` profile [optimized] target(s) in 0.39s
     Running `target/release/baram crawl --category politics --max-articles 50 --output /home/mare/Baram/output/raw --skip-existing`
  [2m2025-12-27T15:00:02.304191Z[0m [32m INFO[0m [1;32mbaram[0m[32m: [32mbaram Naver News Crawler starting[0m
    [2;3mat[0m src/main.rs:254

  [2m2025-12-27T15:00:02.304243Z[0m [33m WARN[0m [1;33mbaram[0m[33m: [33mConfig file not found, using defaults, [1;33mpath[0m[33m: config.toml[0m
    [2;3mat[0m src/main.rs:260

  [2m2025-12-27T15:00:02.304275Z[0m [32m INFO[0m [1;32mbaram[0m[32m: [32mStarting crawl command, [1;32mcategory[0m[32m: Some("politics"), [1;32mmax_articles[0m[32m: 50, [1;32murl[0m[32m: None, [1;32mwith_comments[0m[32m: false, [1;32moutput[0m[32m: /home/mare/Baram/output/raw[0m
    [2;3mat[0m src/main.rs:273

Starting Naver News Crawl
========================
  [2m2025-12-27T15:00:02.305189Z[0m [32m INFO[0m [1;32mbaram::storage[0m[32m: [32mSQLite database initialized, [1;32mpath[0m[32m: /home/mare/Baram/output/crawl.db[0m
    [2;3mat[0m src/storage/mod.rs:109


Crawling category: 정치 (politics)
  [2m2025-12-27T15:00:03.077979Z[0m [32m INFO[0m [1;32mbaram::crawler::list[0m[32m: [32mCompleted URL collection, [1;32mcategory[0m[32m: politics, [1;32mdate[0m[32m: "20251228", [1;32mtotal_urls[0m[32m: 118, [1;32mpages[0m[32m: 4[0m
    [2;3mat[0m src/crawler/list.rs:150

Found 118 article URLs
New articles to crawl: 18 (skipped: 100)
[1/18] Crawling: https://n.news.naver.com/mnews/article/001/0015816...[2/18] Crawling: https://n.news.naver.com/mnews/article/003/0013678...[3/18] Crawling: https://n.news.naver.com/mnews/article/011/0004571...[4/18] Crawling: https://n.news.naver.com/mnews/article/016/0002577...[5/18] Crawling: https://n.news.naver.com/mnews/article/020/0003684...[6/18] Crawling: https://n.news.naver.com/mnews/article/021/0002759...[7/18] Crawling: https://n.news.naver.com/mnews/article/023/0003949...[8/18] Crawling: https://n.news.naver.com/mnews/article/023/0003949...[9/18] Crawling: https://n.news.naver.com/mnews/article/023/0003949...[10/18] Crawling: https://n.news.naver.com/mnews/article/032/0003417...[11/18] Crawling: https://n.news.naver.com/mnews/article/052/0002292...[12/18] Crawling: https://n.news.naver.com/mnews/article/052/0002292...[13/18] Crawling: https://n.news.naver.com/mnews/article/052/0002292...[14/18] Crawling: https://n.news.naver.com/mnews/article/056/0012093...[15/18] Crawling: https://n.news.naver.com/mnews/article/214/0001470...[16/18] Crawling: https://n.news.naver.com/mnews/article/366/0001132...[17/18] Crawling: https://n.news.naver.com/mnews/article/422/0000816...[18/18] Crawling: https://n.news.naver.com/mnews/article/469/0000905...

Crawl Summary
=============
Total processed: 16
Successful: 16
Failed: 0
Output directory: /home/mare/Baram/output/raw
Database: /home/mare/Baram/output/crawl.db

Database Stats
--------------
Total records: 470
Success: 467
Failed: 0
Success rate: 99.4%
  [2m2025-12-27T15:00:11.291896Z[0m [32m INFO[0m [1;32mbaram[0m[32m: [32mbaram completed successfully[0m
    [2;3mat[0m src/main.rs:429

[2025-12-28 00:00:11]   ✓ politics completed
[2025-12-28 00:45:01] =========================================
[2025-12-28 00:45:01] Starting automated crawl & processing
[2025-12-28 00:45:01] =========================================
[2025-12-28 00:45:01] Phase 1: Crawling articles...
[2025-12-28 00:45:01]   Crawling: politics
    Finished `release` profile [optimized] target(s) in 0.37s
     Running `target/release/baram crawl --category politics --max-articles 50 --output /home/mare/Baram/output/raw --skip-existing`
  [2m2025-12-27T15:45:01.891448Z[0m [32m INFO[0m [1;32mbaram[0m[32m: [32mbaram Naver News Crawler starting[0m
    [2;3mat[0m src/main.rs:254

  [2m2025-12-27T15:45:01.891484Z[0m [33m WARN[0m [1;33mbaram[0m[33m: [33mConfig file not found, using defaults, [1;33mpath[0m[33m: config.toml[0m
    [2;3mat[0m src/main.rs:260

  [2m2025-12-27T15:45:01.891507Z[0m [32m INFO[0m [1;32mbaram[0m[32m: [32mStarting crawl command, [1;32mcategory[0m[32m: Some("politics"), [1;32mmax_articles[0m[32m: 50, [1;32murl[0m[32m: None, [1;32mwith_comments[0m[32m: false, [1;32moutput[0m[32m: /home/mare/Baram/output/raw[0m
    [2;3mat[0m src/main.rs:273

Starting Naver News Crawl
========================
  [2m2025-12-27T15:45:01.892406Z[0m [32m INFO[0m [1;32mbaram::storage[0m[32m: [32mSQLite database initialized, [1;32mpath[0m[32m: /home/mare/Baram/output/crawl.db[0m
    [2;3mat[0m src/storage/mod.rs:109


Crawling category: 정치 (politics)
  [2m2025-12-27T15:45:02.657262Z[0m [32m INFO[0m [1;32mbaram::crawler::list[0m[32m: [32mCompleted URL collection, [1;32mcategory[0m[32m: politics, [1;32mdate[0m[32m: "20251228", [1;32mtotal_urls[0m[32m: 117, [1;32mpages[0m[32m: 4[0m
    [2;3mat[0m src/crawler/list.rs:150

Found 117 article URLs
New articles to crawl: 38 (skipped: 79)
[1/38] Crawling: https://n.news.naver.com/mnews/article/001/0015816...[2/38] Crawling: https://n.news.naver.com/mnews/article/002/0002420...[3/38] Crawling: https://n.news.naver.com/mnews/article/003/0013679...[4/38] Crawling: https://n.news.naver.com/mnews/article/003/0013679...[5/38] Crawling: https://n.news.naver.com/mnews/article/005/0001822...[6/38] Crawling: https://n.news.naver.com/mnews/article/008/0005297...[7/38] Crawling: https://n.news.naver.com/mnews/article/011/0004572...[8/38] Crawling: https://n.news.naver.com/mnews/article/014/0005454...[9/38] Crawling: https://n.news.naver.com/mnews/article/016/0002577...[10/38] Crawling: https://n.news.naver.com/mnews/article/016/0002577...[11/38] Crawling: https://n.news.naver.com/mnews/article/018/0006190...[12/38] Crawling: https://n.news.naver.com/mnews/article/023/0003949...[13/38] Crawling: https://n.news.naver.com/mnews/article/024/0000102...[14/38] Crawling: https://n.news.naver.com/mnews/article/025/0003492...[15/38] Crawling: https://n.news.naver.com/mnews/article/029/0003001...[16/38] Crawling: https://n.news.naver.com/mnews/article/030/0003384...[17/38] Crawling: https://n.news.naver.com/mnews/article/031/0000992...[18/38] Crawling: https://n.news.naver.com/mnews/article/050/0000100...[19/38] Crawling: https://n.news.naver.com/mnews/article/052/0002292...[20/38] Crawling: https://n.news.naver.com/mnews/article/052/0002292...[21/38] Crawling: https://n.news.naver.com/mnews/article/052/0002292...[22/38] Crawling: https://n.news.naver.com/mnews/article/052/0002292...[23/38] Crawling: https://n.news.naver.com/mnews/article/056/0012094...[24/38] Crawling: https://n.news.naver.com/mnews/article/057/0001927...[25/38] Crawling: https://n.news.naver.com/mnews/article/081/0003604...[26/38] Crawling: https://n.news.naver.com/mnews/article/082/0001360...[27/38] Crawling: https://n.news.naver.com/mnews/article/243/0000090...[28/38] Crawling: https://n.news.naver.com/mnews/article/277/0005699...[29/38] Crawling: https://n.news.naver.com/mnews/article/310/0000132...[30/38] Crawling: https://n.news.naver.com/mnews/article/346/0000102...[31/38] Crawling: https://n.news.naver.com/mnews/article/422/0000816...[32/38] Crawling: https://n.news.naver.com/mnews/article/629/0000457...[33/38] Crawling: https://n.news.naver.com/mnews/article/629/0000457...[34/38] Crawling: https://n.news.naver.com/mnews/article/648/0000043...[35/38] Crawling: https://n.news.naver.com/mnews/article/656/0000160...[36/38] Crawling: https://n.news.naver.com/mnews/article/660/0000099...[37/38] Crawling: https://n.news.naver.com/mnews/article/665/0000006...[38/38] Crawling: https://n.news.naver.com/mnews/article/666/0000091...

Crawl Summary
=============
Total processed: 36
Successful: 36
Failed: 0
Output directory: /home/mare/Baram/output/raw
Database: /home/mare/Baram/output/crawl.db

Database Stats
--------------
Total records: 506
Success: 503
Failed: 0
Success rate: 99.4%
  [2m2025-12-27T15:45:20.899510Z[0m [32m INFO[0m [1;32mbaram[0m[32m: [32mbaram completed successfully[0m
    [2;3mat[0m src/main.rs:429

[2025-12-28 00:45:20]   ✓ politics completed
